<?xml version="1.0" encoding="UTF-8"?>
 <!DOCTYPE Students SYSTEM "StudentList.dtd">
<Students>

    <Student>
        <Id>10236</Id>
        <name>Ruhul</name>
        <Age>22</Age>
        <Email>Ruhul@gmail.com</Email>
    </Student>

    <Student>
        <Id>10011</Id>
        <name>Shamim</name>
        <Age>21</Age>
        <Email>Shamim@gmail.com</Email>
    </Student>

</Students>